{
  "schema_version": "0.9.0",
  "maturity": {
    "rung": "sandbox",
    "entered_at": "2026-09-01",
    "notes": "Synthetic. Generated by examples/make_examples.py to exercise the schema end to end, and not a measurement of anything. Nothing downstream should treat it as data."
  },
  "dataset_id": "prbs-co-ox-synthetic-001",
  "batch_id": "synthetic-batch-a",
  "lineage_id": "synthetic-co-ox-lineage",
  "layer": "canonical",
  "status": "ok",
  "autonomy_level": "A1",
  "measurement_type": "prbs_kinetics",
  "sample_id": "SYNTH-CATALYST-001",
  "instrument": {
    "model": "Synthetic quadrupole MS on synthetic PRBS reactor",
    "identifier": "MS-Q1-SYNTH",
    "site": "gt"
  },
  "channels": {
    "time_s": {
      "units": "s",
      "quantity": "time",
      "uncertainty": {
        "kind": "constant_sigma",
        "value": 0.001,
        "noise_model": {
          "family": "calibrated_estimate",
          "notes": "Sampling jitter."
        }
      }
    },
    "m28": {
      "units": "A",
      "quantity": "ion_current",
      "uncertainty": {
        "kind": "sigma_column",
        "column": "m28_sigma",
        "noise_model": {
          "family": "gaussian_heteroscedastic",
          "notes": "Synthetic: relative detector noise plus a constant floor."
        }
      },
      "mz": 28,
      "species": "CO"
    },
    "m32": {
      "units": "A",
      "quantity": "ion_current",
      "uncertainty": {
        "kind": "sigma_column",
        "column": "m32_sigma",
        "noise_model": {
          "family": "gaussian_heteroscedastic",
          "notes": "Synthetic: relative detector noise plus a constant floor."
        }
      },
      "mz": 32,
      "species": "O2"
    },
    "m44": {
      "units": "A",
      "quantity": "ion_current",
      "mz": 44,
      "species": "CO2"
    }
  },
  "files": [
    {
      "sha256": "424b4b9ceb4edeb2089f60f7269ef52777ad6a3140c7c7230180b0d262c2cf3a",
      "size_bytes": 439815,
      "format": "csv",
      "path": "examples/data/prbs-co-ox-synthetic.csv",
      "media_type": "text/csv",
      "rows": 5080
    }
  ],
  "protocol": {
    "protocol": "prbs",
    "parameters": {
      "species": "CO",
      "low_mol_frac": 0.005,
      "high_mol_frac": 0.02,
      "waveform": {
        "form": "lfsr",
        "register_length": 7,
        "taps": [
          7,
          6
        ],
        "seed": 1,
        "bit_period_s": 2.0,
        "n_bits": 127
      }
    },
    "base_conditions": {
      "temperature_K": 473.0,
      "pressure_kPa": 101.3,
      "total_flow_sccm": 100.0,
      "carrier": "He",
      "feed_mol_frac": {
        "O2": 0.05,
        "He": 0.93
      },
      "catalyst_mass_g": 0.0502,
      "bed": {
        "length_mm": 10.0,
        "diameter_mm": 4.0,
        "void_fraction": 0.6,
        "particle_diameter_um": 100.0,
        "catalyst_density_kg_per_m3": 2000.0,
        "site_density_umol_per_g": 6.0,
        "source": "SYNTHETIC, chosen to be plausible for a lab microreactor.",
        "notes": "Present so the axial reactor model has something to run against in the examples. A real record must state where each number was measured -- for the CO-oxidation campaigns they existed only inside analysis code, which is the gap this block closes."
      }
    },
    "time_base": {
      "t0": "2026-09-01T14:03:00Z",
      "dt_s": 0.05,
      "n_samples": 5080
    },
    "notes": "SYNTHETIC. Maximal-length LFSR, one full 127-bit period, declared under the lfsr waveform form: register length, taps, and seed are recorded so the waveform can be regenerated exactly rather than re-measured from the trace. Real legacy runs often cannot do this -- see the recorded and reconstructed forms."
  },
  "time_base": {
    "t0": "2026-09-01T14:03:00Z",
    "dt_s": 0.05,
    "n_samples": 5080
  },
  "access_status": "public",
  "license": "CC-BY-4.0",
  "provenance": {
    "artifact_id": "canon-prbs-co-ox-synthetic-2026-09-01-8cf5d3",
    "tool": {
      "name": "tcat-ingest",
      "version": "0.1.0",
      "git_sha": "unknown"
    },
    "inputs": [],
    "parameters": {
      "converter": "ms-csv",
      "source": "examples/make_examples.py"
    },
    "data_schema_version": "0.9.0",
    "autonomy_level": "A1",
    "durability": "durable",
    "created_at": "2026-09-01T14:20:11Z",
    "host": "example-generator",
    "notes": "Generated by examples/make_examples.py, not by a real tool run."
  },
  "calibration_ref": "art://cal-msq1-synthetic-2026-09-01-dd9265",
  "reaction_system": "CO oxidation",
  "catalyst_family": "synthetic",
  "funding": [
    {
      "funder": "US Department of Energy",
      "award": "DE-FOA-0003612",
      "program": "Genesis Mission"
    }
  ],
  "notes": "SYNTHETIC EXEMPLAR -- not measured data. Exists so that every required field has a worked, checkable value, and so the manifest indirection can be verified end to end: the sha256 below is the real checksum of examples/data/prbs-co-ox-synthetic.csv. Layer is canonical because the channels are ion currents with explicit units and per-point sigma; it is NOT derived, because no calibration has been applied -- calibration_ref records which calibration would apply, not one that has been used."
}
